{
    "tex0": {
        "filename": "../../images/spell/fire_particle.png",
        "s": {
            "repeats": 0,
            "mirror": false
        },
        "t": {
            "repeats": 0,
            "mirror": false
        }
    },
    "combineMode": [{
        "color": ["TEX0", "0", "PRIM", "0"],
        "alpha": ["TEX0", "0", "PRIM", "0"]
    }],
    "primColor": [255, 255, 255, 255],
    "blendMode": "ALPHA_CLIP",
    "zBuffer": true
}